Job Title,Company,Date,Type,Location,Skills,Job Link
internal auditor,Roasty,posted 24 days ago,Full Time,"Qalyub, Qalubia","Accounting/Finance, Quality, Analyst/Research, Strong analytical skills, Basic knowledge of internal audit and financial control Proficient in Microsoft Excel and Word, Ability to prepare financial reports, Excellent communication and presentation skills",http://wuzzuf.net/jobs/p/cumgbhgdh4re-internal-auditor-roasty-qalubia-egypt
Costing Section Head,Holw El Sham,posted 22 days ago,Full Time,"6th of October, Giza","Accounting/Finance, Operations/Management, Analyst/Research, Management, Microsoft Office, Cost accounting & variance analysis, Budgeting and forecasting, Advanced Excel & ERP systems, Analytical and problem-solving skills, Leadership and communication skills, Manufacturing cost reduction, Accounting, Cost Accounting, Finance, Manufacturing",http://wuzzuf.net/jobs/p/irspzx4aztx7-costing-section-head-holw-el-sham-giza-egypt
PHP Full Stack Developer,Mora Communications Comp,posted 18 days ago,Full Time,"New Cairo, Cairo","IT/Software Development, Engineering - Telecom/Technology, PHP, Node.js, Mongo DB, Bootstrap, Computer Science, Software Development, HTML, CSS, Information Technology (IT), JavaScript, jQuery, Laravel, MySQL",http://wuzzuf.net/jobs/p/0whsflbxuria-php-full-stack-developer-mora-communications-company-cairo-egypt
Software Development Specialist,Help AG,posted 2 months ago,Full Time,"Maadi, Cairo","IT/Software Development, Angular, React, Spring Boot, micro services, java Frameworks, Docker, Azure DevOps Server, Kubernetes, Azure, oci",http://wuzzuf.net/jobs/p/acahyftsi8x8-software-development-specialist-help-ag-cairo-egypt
ServiceNow Technical Lead,AZM Squad,posted 30 days ago,Full Time,"Riyadh, Saudi Arabia","IT/Software Development, ServiceNow, ServiceNow implementations, ServiceNow scripting and platform customization, Development and architecture, Business Rules, Script Includes, Client Scripts, UI Policies, Flow Designer, IntegrationHub, technical leadership, Communication, Leadership Management, Stakeholders",http://wuzzuf.net/saudi/jobs/p/l71avcokgbfk-servicenow-technical-lead-azm-squad-riyadh-saudi-arabia
Economic Researcher - Scriptwriting/Content,Trendz Agency,posted 15 days ago,Full Time,"Abu Dhabi, United Arab Emirates","Writing/Editorial, Analyst/Research, Media/Journalism/Publishing, Economic research, Scriptwriting, Finance, Investment Analysis, Financial Analysis, Content Writing, Communication",http://wuzzuf.net/jobs/p/seud77zjcepb-economic-researcher-scriptwritingcontent-trendz-agency-abu-dhabi-united-arab-emirates
Cost Accountant,Rehana Group,posted 1 month ago,Full Time,"Qanater Khairya, Qalubia","Accounting/Finance, Analyst/Research, Microsoft Applications, Accounting, Office Applications",http://wuzzuf.net/jobs/p/e9ohazjzlazc-cost-accountant-rehana-group-qalubia-egypt
Mobile Developer – Flutter,Daam,posted 1 month ago,Full Time,"Maadi, Cairo","Creative/Design/Art, IT/Software Development, Engineering - Telecom/Technology, Mobile Development, Information Technology (IT), CI/CD, UI/UX, Firestore, MVVM",http://wuzzuf.net/jobs/p/foqqrgbdzmau-mobile-developer-flutter-daam-cairo-egypt
Equity Trader,Apex Financial Holding,posted 2 months ago,Full Time,"Agouza, Giza","Accounting/Finance, Equity Trading, Market Analysis, Communication",http://wuzzuf.net/jobs/p/crflnrhk1jvw-equity-trader-apex-financial-holding-giza-egypt
Quality Assurance Supervisor.,Etisalat Egypt,posted 19 days ago,Full Time,"Maadi, Cairo","Customer Service/Support, Quality, Quality Assurance, Quality Control, QA, Supervision, Quality Management, Customer Service, Customer Support, Customer Care, Customer Relations, Custom Clearance, Customer Satisfaction, Customer Service Management, Call Center",http://wuzzuf.net/jobs/p/wkvbqzafsrkd-quality-assurance-supervisor-etisalat-egypt-cairo-egypt
Oracle Developer,Blue Bell Egypt,posted 2 months ago,Full Time,"Bourj Alarab, Alexandria","Installation/Maintenance/Repair, IT/Software Development, Engineering - Telecom/Technology, Oracle PL/SQL, Database Design, Analytical Thinking, Team Collaboration, Problem Solving, Technical Documentation",http://wuzzuf.net/jobs/p/e6h25xmvgiej-oracle-developer-blue-bell-egypt-alexandria-egypt
